Title,DOI
AgronomicTaxon (ATC),http://ontology.irstea.fr/agronomictaxon/core#
GEneral Multilingual Environmental Thesaurus (GEMET),https://agroportal.lirmm.fr/ontologies/GEMET/submissions/14
Common Greenhouse Ontology (CGO),https://www.tno.nl/agrifood/ontology/common-greenhouse-ontology#
Ontology of units of Measure (OM),http://www.ontology-of-units-of-measure.org/resource/om-2
Ontology for Experimental Scientific Objects Core (OESO-CORE),http://www.opensilex.org/vocabulary/oeso
Smart Applications REFerence ontology (SAREF),https://saref.etsi.org/core/